<xs:schema attributeFormDefault="unqualified"
	elementFormDefault="qualified" xmlns:xs="http://www.w3.org/2001/XMLSchema">
	<xs:element name="localization">
		<xs:annotation>
		</xs:annotation>
		<xs:complexType>
			<xs:sequence>
				<xs:element name="message" maxOccurs="unbounded"
					minOccurs="0">
					<xs:annotation>
					</xs:annotation>
					<xs:complexType>
						<xs:simpleContent>
							<xs:extension base="xs:string">
								<xs:attribute type="xs:string" name="id" use="optional" />
								<xs:attribute type="xs:string" name="text" use="optional" />
							</xs:extension>
						</xs:simpleContent>
					</xs:complexType>
				</xs:element>
			</xs:sequence>
			<xs:attribute type="xs:string" name="lang" />
			<xs:attribute type="xs:float" name="version" />
			<xs:attribute type="xs:string" name="author" />
		</xs:complexType>
	</xs:element>
</xs:schema>